{
  "title": "Git – podstawy",
  "description": "Wprowadzenie do systemu kontroli wersji: zapis zmian, gałęzie i praca z zespołem.",
  "theme": {
    "accent": "#F05032",
    "background": "#FFFFFF",
    "text": "#1A1A1A",
    "font": "sans"
  },
  "slides": [
    {
      "type": "title",
      "title": "Git – podstawy",
      "subtitle": "Wprowadzenie do systemu kontroli wersji: zapis zmian, gałęzie i praca z zespołem."
    },
    {
      "type": "bullets",
      "title": "Czym jest Git",
      "bullets": [
        "Rozproszony system kontroli wersji",
        "Historia zmian zapisana jako commity",
        "Każdy programista ma pełną kopię repozytorium"
      ],
      "notes": "Zacznij od pytania: co się stanie, jeśli przypadkiem nadpiszesz plik? Git pozwala cofnąć taką zmianę."
    },
    {
      "type": "two-columns",
      "title": "Git a GitHub",
      "left": "Git\nProgram na Twoim komputerze\nZapisuje historię zmian\nDziała bez internetu",
      "right": "GitHub\nSerwis w internecie\nHostuje zdalne repozytoria\nPull requesty i code review"
    },
    {
      "type": "bullets",
      "title": "Cykl zapisu zmian",
      "bullets": [
        "Zmiana w katalogu roboczym",
        "git add – przygotowanie zmian (staging)",
        "git commit – zapis migawki z opisem"
      ],
      "code": "git status\ngit add src/app.js\ngit commit -m \"feat: add login form\"",
      "notes": "Po każdym kroku pokaż git status, żeby uczestnicy widzieli, jak zmienia się stan."
    },
    {
      "type": "bullets",
      "title": "Gałęzie",
      "bullets": [
        "Gałąź to lekka ścieżka rozwoju",
        "main to gałąź główna",
        "Nową funkcję rozwijaj na osobnej gałęzi"
      ],
      "code": "git switch -c feature/logowanie\n# praca i commity na gałęzi\ngit switch main\ngit merge feature/logowanie",
      "notes": "Pokaż, że przełączanie gałęzi zmienia pliki w katalogu roboczym."
    },
    {
      "type": "bullets",
      "title": "Praca ze zdalnym repozytorium",
      "bullets": [
        "origin to domyślna nazwa zdalnego repozytorium",
        "git pull pobiera zmiany innych osób",
        "git push wysyła Twoje commity"
      ],
      "code": "git pull --rebase\ngit push -u origin feature/logowanie",
      "notes": "Warto wspomnieć o pull request jako sposobie przeglądu kodu przed scaleniem."
    },
    {
      "type": "bullets",
      "title": "Najczęstsze błędy",
      "bullets": [
        "Commit z hasłem lub kluczem API – trzeba go unieważnić, nie wystarczy usunąć",
        "Praca bezpośrednio na main",
        "Duże commity bez sensownego opisu"
      ],
      "notes": "Przykłady z życia są najlepsze. Zapytaj grupę, czy ktoś miał taki problem."
    },
    {
      "type": "quote",
      "title": "Dla zabawy",
      "quote": "Talk is cheap. Show me the code.",
      "author": "Linus Torvalds, twórca Gita"
    },
    {
      "type": "bullets",
      "title": "Podsumowanie",
      "bullets": [
        "Commituj małe, logiczne zmiany",
        "Pisz opisy commitów w trybie rozkazującym",
        "Sprawdzaj git status przed każdym commitem"
      ]
    }
  ]
}
